{
  "version": "0.4.0",
  "updatedAt": "2026-06-05",
  "sourceConfidence": "needs-verification",
  "notes": "Shared catalog + two journeys (business registration, land transfer). Both reuse agency.nida/rra/self/bank, art.national-id and svc.verify-national-id — demonstrating cross-journey reuse. Structure & rejection logic are sound; every fee/threshold/regulator-name marked CONFIRM is DRAFT and must be verified via official sources or agent interviews (brainstorm.html Q4) before production use.",

  "agencies": [
    { "id": "agency.nida", "name": "NIDA", "fullName": "National Identification Agency", "type": "national", "notes": "Root of citizen identity. Shared across all journeys." },
    { "id": "agency.rdb", "name": "RDB", "fullName": "Rwanda Development Board", "type": "national", "notes": "Company/business registration; integrated with RRA for TIN." },
    { "id": "agency.rra", "name": "RRA", "fullName": "Rwanda Revenue Authority", "type": "national" },
    { "id": "agency.district", "name": "District", "fullName": "District / Sector local government", "type": "local-government", "notes": "Issues the annual trading license." },
    { "id": "agency.health-regulator", "name": "Health Regulator", "fullName": "Food/health hygiene authority (confirm exact body)", "type": "sector-regulator" },
    { "id": "agency.rssb", "name": "RSSB", "fullName": "Rwanda Social Security Board", "type": "national" },
    { "id": "agency.bank", "name": "Bank", "fullName": "Commercial bank", "type": "financial" },
    { "id": "agency.rlmua", "name": "RLMUA", "fullName": "Rwanda Land Management and Use Authority", "type": "national", "notes": "Land titles, register, transfers (front-door via Irembo)." },
    { "id": "agency.notary", "name": "Notary", "fullName": "Sector / private notary", "type": "external", "notes": "Authenticates land sale agreements & consents." },
    { "id": "agency.self", "name": "Applicant", "fullName": "Citizen / applicant decision", "type": "self" }
  ],

  "artifacts": [
    { "id": "art.structure-decision", "name": "Legal structure decision", "description": "Sole proprietorship/enterprise vs company (Ltd).", "issuedBy": "agency.self", "kind": "decision" },
    { "id": "art.national-id", "name": "Valid National ID", "description": "NIDA identity; foreigners substitute a valid residence permit. SHARED across journeys.", "issuedBy": "agency.nida", "kind": "identity", "expirable": true, "reusable": true },
    { "id": "art.name-reservation", "name": "Reserved business name", "description": "Approved, available business name.", "issuedBy": "agency.rdb", "kind": "registration" },
    { "id": "art.certificate-of-registration", "name": "Certificate of Registration", "description": "The RDB registration certificate. Necessary but NOT sufficient to operate.", "issuedBy": "agency.rdb", "kind": "registration", "reusable": true },
    { "id": "art.tin", "name": "Tax Identification Number (TIN)", "description": "Issued automatically with RDB registration.", "issuedBy": "agency.rra", "kind": "tax-status", "reusable": true },
    { "id": "art.vat-registration", "name": "VAT registration", "description": "Mandatory above the turnover threshold.", "issuedBy": "agency.rra", "kind": "tax-status" },
    { "id": "art.premises-proof", "name": "Proof of premises", "description": "Lease agreement or land title for the trading address.", "issuedBy": "agency.self", "kind": "document", "reusable": true },
    { "id": "art.trading-license", "name": "Trading license", "description": "Annual district-level license/tax granting permission to operate.", "issuedBy": "agency.district", "kind": "license", "expirable": true },
    { "id": "art.health-hygiene-certificate", "name": "Health/hygiene certificate", "description": "Sector permit for food service; other activities route to other regulators.", "issuedBy": "agency.health-regulator", "kind": "permit", "expirable": true },
    { "id": "art.rssb-registration", "name": "RSSB employer registration", "description": "Required once the business hires staff.", "issuedBy": "agency.rssb", "kind": "registration" },
    { "id": "art.business-bank-account", "name": "Business bank account", "issuedBy": "agency.bank", "kind": "financial" },
    { "id": "art.ebm-device", "name": "EBM e-invoicing device", "description": "Electronic billing machine, required for VAT-registered businesses.", "issuedBy": "agency.rra", "kind": "tax-status" },

    { "id": "art.land-title", "name": "Existing land title (UPI)", "description": "The seller's registered title / Unique Parcel Identifier.", "issuedBy": "agency.rlmua", "kind": "document", "reusable": true },
    { "id": "art.encumbrance-clearance", "name": "Encumbrance clearance", "description": "Confirmation the parcel is free of mortgage, caveat or dispute.", "issuedBy": "agency.rlmua", "kind": "document" },
    { "id": "art.mortgage-release", "name": "Mortgage release / bank consent", "description": "Discharge or consent from the lender when the parcel is mortgaged.", "issuedBy": "agency.bank", "kind": "document" },
    { "id": "art.spousal-consent", "name": "Spousal consent", "description": "Consent of the seller's spouse — required under community-of-property marriage.", "issuedBy": "agency.notary", "kind": "document" },
    { "id": "art.coowner-consent", "name": "Co-owner / family consent", "description": "Consent of all co-owners or family members for co-owned or family land.", "issuedBy": "agency.notary", "kind": "document" },
    { "id": "art.land-tax-clearance", "name": "Land lease-fee / property-tax clearance", "description": "Proof outstanding land lease fees and property tax are paid.", "issuedBy": "agency.rra", "kind": "tax-status" },
    { "id": "art.sale-agreement", "name": "Notarized sale agreement", "description": "Authenticated contract of sale between the parties.", "issuedBy": "agency.notary", "kind": "document" },
    { "id": "art.transfer-fee-payment", "name": "Transfer fee payment", "description": "Proof of payment of the land transfer / registration fee.", "issuedBy": "agency.rra", "kind": "financial" },
    { "id": "art.new-land-title", "name": "New land title (buyer)", "description": "Updated register entry / title issued in the buyer's name.", "issuedBy": "agency.rlmua", "kind": "document" }
  ],

  "services": [
    {
      "id": "svc.choose-structure",
      "name": "Decide legal structure",
      "description": "Sole proprietorship/enterprise vs company (Ltd). Silently changes every later step.",
      "agency": "agency.self",
      "channel": "offline-decision",
      "requires": [],
      "produces": ["art.structure-decision"],
      "cost": { "model": "free" },
      "duration": { "unit": "minutes", "min": 5, "max": 30 },
      "rules": [
        {
          "id": "rule.structure-mismatch",
          "kind": "eligibility",
          "severity": "medium",
          "failureMode": "rework",
          "message": "Choosing 'company' when an enterprise was intended triggers requests for articles of association and directors the applicant doesn't have; choosing 'enterprise' for a multi-partner venture forces a later re-registration.",
          "mitigation": "Ask intent (one owner vs partners, raising capital?) and recommend the structure; warn before committing."
        }
      ]
    },
    {
      "id": "svc.verify-national-id",
      "name": "Verify National ID validity",
      "description": "Confirm the applicant's NIDA identity is valid and details match before any form is filled. SHARED across journeys; in land transfer it covers BOTH parties.",
      "agency": "agency.nida",
      "channel": "online-irembo",
      "requires": [],
      "produces": ["art.national-id"],
      "cost": { "model": "free" },
      "duration": { "unit": "instant" },
      "rules": [
        {
          "id": "rule.id-expired",
          "kind": "eligibility",
          "severity": "high",
          "failureMode": "rejection",
          "message": "National ID expired, or name spelling on the form does not match the NIDA record.",
          "mitigation": "Pre-flight ID validity + name-match check; block the journey until resolved."
        },
        {
          "id": "rule.minor",
          "kind": "eligibility",
          "severity": "high",
          "failureMode": "rejection",
          "when": { "var": "applicantAge", "op": "lt", "value": 18 },
          "message": "Applicant is a minor or legally incapacitated and cannot transact without a guardian.",
          "mitigation": "Detect age from ID; explain the constraint and the guardian route up front."
        },
        {
          "id": "rule.foreigner-status",
          "kind": "eligibility",
          "severity": "high",
          "failureMode": "rejection",
          "when": { "var": "isForeigner", "op": "eq", "value": true },
          "message": "Foreign applicant lacks the status this transaction requires (residence permit to trade; foreigners may generally hold land only on leasehold).",
          "mitigation": "Branch to the correct non-citizen prerequisites for the journey."
        }
      ]
    },
    {
      "id": "svc.provide-premises-proof",
      "name": "Secure proof of premises",
      "description": "Citizen-supplied input: a lease agreement or land title for the trading address. Not a government service, but a prerequisite the agent must collect early — it gates two later steps.",
      "agency": "agency.self",
      "channel": "offline-decision",
      "requires": [],
      "produces": ["art.premises-proof"],
      "cost": { "model": "variable", "note": "Rent/lease cost — outside the registration system." },
      "duration": { "unit": "days", "min": 0, "max": 30 },
      "rules": [
        {
          "id": "rule.no-lease-ready",
          "kind": "external-dependency",
          "severity": "high",
          "failureMode": "rework",
          "message": "Applicant reaches the trading-license / sector-permit steps without a lease or title in hand, and stalls.",